{
  "dataset": "proposal_tags",
  "as_of": "2026-03-19T03:09:37.256111Z",
  "version": 1,
  "records": [
    {
      "archive_id": "gnars-base-119",
      "title": "Pod Media Strategy - Q1 2026",
      "platform": "gnars.com",
      "chain": "base",
      "proposal_number": 119,
      "source_url": "https://www.gnars.com/proposals/base/119",
      "tagging_status": "queued",
      "review_state": "pending",
      "scope": "pilot-30",
      "primary_category": null,
      "secondary_categories": [],
      "funding_category": null,
      "lifecycle_stage": null,
      "entities": [],
      "confidence": null,
      "requires_human_review": true,
      "model_provider": null,
      "model_name": null,
      "guidelines_version": "2026-03-18",
      "rationale": null,
      "notes": "Seeded for pilot tagging queue.",
      "updated_at": "2026-03-18T22:10:35.095440Z"
    },
    {
      "archive_id": "gnars-base-118",
      "title": "Gnars Operations - Q1 2026 Workstream Proposal",
      "platform": "gnars.com",
      "chain": "base",
      "proposal_number": 118,
      "source_url": "https://www.gnars.com/proposals/base/118",
      "tagging_status": "queued",
      "review_state": "pending",
      "scope": "pilot-30",
      "primary_category": null,
      "secondary_categories": [],
      "funding_category": null,
      "lifecycle_stage": null,
      "entities": [],
      "confidence": null,
      "requires_human_review": true,
      "model_provider": null,
      "model_name": null,
      "guidelines_version": "2026-03-18",
      "rationale": null,
      "notes": "Seeded for pilot tagging queue.",
      "updated_at": "2026-03-18T22:10:35.095440Z"
    },
    {
      "archive_id": "gnars-base-117",
      "title": "Sponsor Gnars Monik Santos in QS/WSL 2026",
      "platform": "gnars.com",
      "chain": "base",
      "proposal_number": 117,
      "source_url": "https://www.gnars.com/proposals/base/117",
      "tagging_status": "queued",
      "review_state": "pending",
      "scope": "pilot-30",
      "primary_category": null,
      "secondary_categories": [],
      "funding_category": null,
      "lifecycle_stage": null,
      "entities": [],
      "confidence": null,
      "requires_human_review": true,
      "model_provider": null,
      "model_name": null,
      "guidelines_version": "2026-03-18",
      "rationale": null,
      "notes": "Seeded for pilot tagging queue.",
      "updated_at": "2026-03-18T22:10:35.095440Z"
    },
    {
      "archive_id": "gnars-base-116",
      "title": "Resolution: Autonomous Agent Participation in Gnars Governance",
      "platform": "gnars.com",
      "chain": "base",
      "proposal_number": 116,
      "source_url": "https://www.gnars.com/proposals/base/116",
      "tagging_status": "queued",
      "review_state": "pending",
      "scope": "pilot-30",
      "primary_category": null,
      "secondary_categories": [],
      "funding_category": null,
      "lifecycle_stage": null,
      "entities": [],
      "confidence": null,
      "requires_human_review": true,
      "model_provider": null,
      "model_name": null,
      "guidelines_version": "2026-03-18",
      "rationale": null,
      "notes": "Seeded for pilot tagging queue.",
      "updated_at": "2026-03-18T22:10:35.095440Z"
    },
    {
      "archive_id": "gnars-base-115",
      "title": "Resolution: Autonomous Agent Participation in Gnars Governance",
      "platform": "gnars.com",
      "chain": "base",
      "proposal_number": 115,
      "source_url": "https://www.gnars.com/proposals/base/115",
      "tagging_status": "queued",
      "review_state": "pending",
      "scope": "pilot-30",
      "primary_category": null,
      "secondary_categories": [],
      "funding_category": null,
      "lifecycle_stage": null,
      "entities": [],
      "confidence": null,
      "requires_human_review": true,
      "model_provider": null,
      "model_name": null,
      "guidelines_version": "2026-03-18",
      "rationale": null,
      "notes": "Seeded for pilot tagging queue.",
      "updated_at": "2026-03-18T22:10:35.095440Z"
    },
    {
      "archive_id": "gnars-base-114",
      "title": "Resolution: Autonomous Agent Participation in Gnars Governance",
      "platform": "gnars.com",
      "chain": "base",
      "proposal_number": 114,
      "source_url": "https://www.gnars.com/proposals/base/114",
      "tagging_status": "queued",
      "review_state": "pending",
      "scope": "pilot-30",
      "primary_category": null,
      "secondary_categories": [],
      "funding_category": null,
      "lifecycle_stage": null,
      "entities": [],
      "confidence": null,
      "requires_human_review": true,
      "model_provider": null,
      "model_name": null,
      "guidelines_version": "2026-03-18",
      "rationale": null,
      "notes": "Seeded for pilot tagging queue.",
      "updated_at": "2026-03-18T22:10:35.095440Z"
    },
    {
      "archive_id": "gnars-base-113",
      "title": "Co-Sponsor Builder Nouns The Documentary",
      "platform": "gnars.com",
      "chain": "base",
      "proposal_number": 113,
      "source_url": "https://www.gnars.com/proposals/base/113",
      "tagging_status": "queued",
      "review_state": "pending",
      "scope": "pilot-30",
      "primary_category": null,
      "secondary_categories": [],
      "funding_category": null,
      "lifecycle_stage": null,
      "entities": [],
      "confidence": null,
      "requires_human_review": true,
      "model_provider": null,
      "model_name": null,
      "guidelines_version": "2026-03-18",
      "rationale": null,
      "notes": "Seeded for pilot tagging queue.",
      "updated_at": "2026-03-18T22:10:35.095440Z"
    },
    {
      "archive_id": "gnars-base-112",
      "title": "GNARS PRESENTS: GAME OF PAM 2026 - ROOSEVELT SQUARE",
      "platform": "gnars.com",
      "chain": "base",
      "proposal_number": 112,
      "source_url": "https://www.gnars.com/proposals/base/112",
      "tagging_status": "queued",
      "review_state": "pending",
      "scope": "pilot-30",
      "primary_category": null,
      "secondary_categories": [],
      "funding_category": null,
      "lifecycle_stage": null,
      "entities": [],
      "confidence": null,
      "requires_human_review": true,
      "model_provider": null,
      "model_name": null,
      "guidelines_version": "2026-03-18",
      "rationale": null,
      "notes": "Seeded for pilot tagging queue.",
      "updated_at": "2026-03-18T22:10:35.095440Z"
    },
    {
      "archive_id": "gnars-base-111",
      "title": "Gnars Revamp: Docs and Governance",
      "platform": "gnars.com",
      "chain": "base",
      "proposal_number": 111,
      "source_url": "https://www.gnars.com/proposals/base/111",
      "tagging_status": "queued",
      "review_state": "pending",
      "scope": "pilot-30",
      "primary_category": null,
      "secondary_categories": [],
      "funding_category": null,
      "lifecycle_stage": null,
      "entities": [],
      "confidence": null,
      "requires_human_review": true,
      "model_provider": null,
      "model_name": null,
      "guidelines_version": "2026-03-18",
      "rationale": null,
      "notes": "Seeded for pilot tagging queue.",
      "updated_at": "2026-03-18T22:10:35.095440Z"
    },
    {
      "archive_id": "gnars-base-110",
      "title": "Gnargentina Tour",
      "platform": "gnars.com",
      "chain": "base",
      "proposal_number": 110,
      "source_url": "https://www.gnars.com/proposals/base/110",
      "tagging_status": "queued",
      "review_state": "pending",
      "scope": "pilot-30",
      "primary_category": null,
      "secondary_categories": [],
      "funding_category": null,
      "lifecycle_stage": null,
      "entities": [],
      "confidence": null,
      "requires_human_review": true,
      "model_provider": null,
      "model_name": null,
      "guidelines_version": "2026-03-18",
      "rationale": null,
      "notes": "Seeded for pilot tagging queue.",
      "updated_at": "2026-03-18T22:10:35.095440Z"
    },
    {
      "archive_id": "gnars-base-109",
      "title": "Funding Luke Dixon—the best amateur kitesurfer in South Africa",
      "platform": "gnars.com",
      "chain": "base",
      "proposal_number": 109,
      "source_url": "https://www.gnars.com/proposals/base/109",
      "tagging_status": "queued",
      "review_state": "pending",
      "scope": "pilot-30",
      "primary_category": null,
      "secondary_categories": [],
      "funding_category": null,
      "lifecycle_stage": null,
      "entities": [],
      "confidence": null,
      "requires_human_review": true,
      "model_provider": null,
      "model_name": null,
      "guidelines_version": "2026-03-18",
      "rationale": null,
      "notes": "Seeded for pilot tagging queue.",
      "updated_at": "2026-03-18T22:10:35.095440Z"
    },
    {
      "archive_id": "gnars-base-108",
      "title": "SKATE ACROSS AFRICA (EAST COAST - SOUTH COAST)",
      "platform": "gnars.com",
      "chain": "base",
      "proposal_number": 108,
      "source_url": "https://www.gnars.com/proposals/base/108",
      "tagging_status": "queued",
      "review_state": "pending",
      "scope": "pilot-30",
      "primary_category": null,
      "secondary_categories": [],
      "funding_category": null,
      "lifecycle_stage": null,
      "entities": [],
      "confidence": null,
      "requires_human_review": true,
      "model_provider": null,
      "model_name": null,
      "guidelines_version": "2026-03-18",
      "rationale": null,
      "notes": "Seeded for pilot tagging queue.",
      "updated_at": "2026-03-18T22:10:35.095440Z"
    },
    {
      "archive_id": "gnars-base-107",
      "title": "SKATE ACROSS AFRICA EAST COAST - SOUTH COAST",
      "platform": "gnars.com",
      "chain": "base",
      "proposal_number": 107,
      "source_url": "https://www.gnars.com/proposals/base/107",
      "tagging_status": "queued",
      "review_state": "pending",
      "scope": "pilot-30",